title,price,rating,reviews,availability
"HP Pavilion Laptop (2022 Model), 15.6"" HD Display, Intel Celeron Quad-Core Processor, 16GB DDR4 RAM, 1TB SSD, Online Conferencing, Webcam, HDMI, WiFi, Bluetooth, Windows 11", $469.00 ,4.3 out of 5 stars,290 ratings,Not Available
"2022 HP Premium 14-inch HD Thin and Light Laptop, Intel Quad-Core Processor, 16GB RAM, 64GB Storage, Long Battery Life, Webcam, Bluetooth, HDMI, Wi-Fi, Rose Gold, Windows 11 + 1 Year Microsoft 365", $369.00 ,,332 ratings,Not Available
"SGIN Laptop 15.6 Inch, 4GB DDR4 128GB SSD Windows 11 Laptops with Intel Celeron N4020C(up to 2.8 GHz), Intel UHD Graphics 600, Mini HDMI, WiFi, Webcam, USB3.0, Bluetooth 4.2", $999.98 ,4.4 out of 5 stars,336 ratings,Not Available
"Lenovo 2022 Newest Ideapad 3 Laptop, 15.6"" HD Touchscreen, 11th Gen Intel Core i3-1115G4 Processor, 8GB DDR4 RAM, 256GB PCIe NVMe SSD, HDMI, Webcam, Wi-Fi 5, Bluetooth, Windows 11 Home, Almond", $379.00 ,4.4 out of 5 stars,"2,294 ratings",Not Available
"2021 HP Stream 14"" HD SVA Laptop Computer, Intel Celeron N4000 Processor, 4GB RAM, 64GB eMMC Flash Memory, Webcam, 1-Year Office, Intel UHD Graphics 600, Win 10S, Rose Pink, 32GB SnowBell USB Card", $289.00 ,,891 ratings,Not Available
"HP 2022 Newest Pavilion 15.6"" HD Laptop, Intel Quad-core Pentium Processor, 16GB RAM, 1TB SSD, 11 Hr Battry Life, Intel UHD Graphics, HD Webcam, Bluetooth, HDMI, USB Type-C, Scarlet Red, Win 11", $469.00 ,4.3 out of 5 stars,207 ratings,Not Available
"2022 Newest Lenovo IdeaPad 3i 15.6"" FHD Laptop, 11th Gen Intel Core i3-1115G4 Processor, 20 GB DDR4 RAM, 1 TB PCIe NVMe SSD, WiFi, Long Battery Life, Fingerprint Reader, Windows 11, Abyss Blue", $499.99 ,4.4 out of 5 stars,107 ratings,Not Available
"Acer 2023 Newest Aspire 5 Slim Laptop, 15.6"" Full HD Display, 12GB RAM, 1TB SSD Storage, AMD Ryzen 4-Core Processor, Backlit Keyboard, Fingerprint Login, HDMI, Ethernet Port, Type-C, Windows 11 S", $479.99 ,4.3 out of 5 stars,29 ratings,Not Available
"2022 Newest HP 14"" FHD Laptop for Business and Student, AMD Ryzen3 3250U (Beat i5 7200U), 16GB RAM, 1TB SSD, Webcam, Wi-Fi, Bluetooth, HDMI, Fast Charge, Windows 11, ROKC Mousepad", $509.99 ,4.3 out of 5 stars,31 ratings,Not Available
"HP 2022 New 15 Laptop, 15.6"" HD LED Display, Intel Dual-Core Processor, Intel UHD Graphics, 16GB DDR4 RAM, 1TB SSD, Ethernet Port, USB Type-C, Long Battery Life, Windows 11", $479.00 ,4.3 out of 5 stars,568 ratings,Not Available
"Samsung Chromebook 4 (2021 Model) 11.6"" Intel UHD Graphics 600, Intel Celeron Processor N4020, 4GB, 16GB- Wi-Fi - Satin Gray- (XE310XBA-KB1US)", $114.99 ,4.3 out of 5 stars,41 ratings,Not Available
"HP Pavilion 15.6"" FHD Touchscreen Laptop, AMD Ryzen 7-5825U Processor (Beat i7-1180G7),32GB RAM, 1TB PCIe SSD, Wi-Fi 6, Backlit Keyboard, HDMI, Webcam, Bluetooth, Windows 11 Home, Silver", $799.99 ,,6 ratings,Not Available
"Acer Aspire 5 A515-45-R74Z Slim Laptop | 15.6"" Full HD IPS | AMD Ryzen 5 5500U Hexa-Core Mobile Processor | AMD Radeon Graphics | 8GB DDR4 | 256GB NVMe SSD | WiFi 6 | Backlit KB | Windows 11 Home",$399.99,4.5 out of 5 stars,"39,640 ratings",In Stock
"Lenovo 14"" Laptop, IdeaPad 1, Intel Quad-core Processor, 14"" HD Anti-Glare Display, 4GB RAM, HDMI, SD Card Reader, Long Battery Life, Includes MS Office 365, Windows 11 Home in S Mode (256GB SSD)", $199.00 ,,5 ratings,Not Available
"Lenovo IdeaPad 15.6"" Laptop Newest, 15.6 Inch HD Anti-Glare Display, AMD Dual-core Processor, 20GB RAM 1TB SSD, WiFi6 Bluetooth5, 9.5Hr Battery, Windows 11 +GM Accessories", $398.00 ,,11 ratings,Not Available
"[2021 Version]ASUS Vivobook Laptop L210 11.6” ultra thin, Intel Celeron N4020 Processor, 4GB RAM, 64GB eMMC storage, Windows 10 Home in S mode with One Year of Office 365 Personal, L210MA-DB01", $149.00 ,4.3 out of 5 stars,"8,106 ratings",Not Available
"2022 Newest HP Premium 14-inch HD Touchscreen Laptop, Intel Dual-Core Processor Up to 2.8GHz, 16GB RAM, 64GB eMMC Storage, Webcam, Bluetooth, HDMI, Wi-Fi, Blue, Windows 10 with 1 Year Microsoft 365", $429.00 ,4.3 out of 5 stars,208 ratings,Not Available
"Lenovo 15.6"" IdeaPad 1 Laptop, 20GB Memory, 1TB SSD Storage, Intel Pentium Processor (4-cores, 3.3GHz), 15.6"" Anti-glare Display, Wi-Fi 6 and Bluetooth, HDMI, Type-C, 1 Year Office 365,Windows 11 Home", $398.74 ,4.5 out of 5 stars,62 ratings,Not Available
"Lenovo IdeaPad 1 14 Laptop, 14.0"" HD Display, Intel Celeron N4020, 4GB RAM, 64GB Storage, Intel UHD Graphics 600, Win 11 in S Mode, Cloud Grey", $168.00 ,4.3 out of 5 stars,57 ratings,Not Available
"Acer Aspire 5 A515-56-32DK Slim Laptop - 15.6"" Full HD IPS Display - 11th Gen Intel i3-1115G4 Dual Core Processor - 4GB DDR4 - 128GB NVMe SSD - WiFi 6 - Amazon Alexa - Windows 11 Home in S mode.",$269.99,4.3 out of 5 stars,"1,714 ratings",In Stock
"ASUS 2022 Newest Military-Grade Student Laptop, 11.6'' HD Certified Eye-Care Display, Intel Dual-Core Processor, 4GB RAM, Ethernet Port, Keyboard, USB Type-C, Win10 Pro (256GB Storage) (BR1100)", $188.99 ,4.3 out of 5 stars,175 ratings,Not Available
"Lenovo ThinkBook 15 G3 Business Laptop, AMD Octa-Core Ryzen 7 5700U, 15.6"" FHD IPS Anti-Glare Display, 24GB RAM, 1TB PCIe NVMe SSD, Wi-Fi 6, Backlit KB, Fingerprint Reader, Windows 10 Pro", $799.99 ,,1 rating,Not Available
"HP Laptop, 15.6"" HD Screen, Intel Pentium Silver N5030 4 Cores Processor, 32GB Memory, 1TB SSD, USB-C, SD Card Reader, RJ-45, 1-Year Office365 Subscription, HDMI, Wi-Fi, Windows OS, Red, JVQ MP", $499.00 ,,1 rating,Not Available
"Dell Inspiron Laptop, 15.6"" HD Display, AMD Ryzen 5 3450U Processor, 32GB RAM, 1TB SSD, Webcam, HDMI, SD Card Reader, Wi-Fi, Windows 11 Home, Carbon Black", $551.98 ,4.5 out of 5 stars,42 ratings,Not Available
"Lenovo IdeaPad 1i Laptop 14"" HD Display, Intel Pentium Silver N5030 Processor(4-Core, up to 3.1 GHz), 4GB RAM, 256GB Storage(128GB eMMC + 128GB MSD Card), 10Hr Battery, Win 11 S, 1 Year Microsoft 365", $219.00 ,,34 ratings,Not Available
"HP Newest 15.6"" Laptop , FHD, AMD R5-5500U, 8GB RAM, 256GB SSD, USB Type-C and USB Type-A , HDMI, Built-in Microphone/ Webcam, Windows 11, Spruce Blue", $439.99 ,4.7 out of 5 stars,938 ratings,Not Available
"HP Pavilion Laptop (2021 Latest Model), 15.6"" FHD Display, Intel Celeron Processor, 16GB DDR4 RAM, 1TB SSD, Online Conferencing, Webcam, HDMI, WiFi, Bluetooth, Windows 10", $549.99 ,,126 ratings,Not Available
